{
  "version": "0.1.0",
  "id": "plan-001",
  "goal": "Add safe math.add and prove semver compliance",
  "status": "pending",
  "steps": [
    { "id": "s1", "operator": "Meet", "input_refs": ["h-1","k-semver-1"], "expected": "design chosen" },
    { "id": "s2", "operator": "Generalize", "input_refs": ["h-1"], "expected": "api spec" },
    { "id": "s3", "operator": "Verify", "input_refs": ["pcap-001"], "expected": "attested" }
  ],
  "budgets": { "time_ms": 5000, "audit_cost": 1.0, "max_replans": 3 },
  "created_at": "2025-09-26T08:30:00Z"
}